{
    "topic": "mars/telemetry/life_support",
    "event_time": "2026-03-06T00:01:18.531242+00:00",
    "source": {
        "system": "life-support",
        "segment": "habitat-alpha"
    },
    "measurements": [
        {
            "metric": "oxygen_percent",
            "value": 19.49,
            "unit": "%"
        }
    ],
    "status": "warning"
}
